Name,Type,Description,Link,Functional Category,Status,OS Min Compatible,Measure Type,Toolkit Wrapper,Source Repo
Create Bar From Space Type Ratios,Ruby measure,"Creates one or more rectangular building elements based on space type ratios of selected mix of building types, along with user arguments that describe the desired geometry characteristics.Repo: NREL/openstudio-model-articulation-gem",https://bcl.nrel.gov/content/3e988765-9673-46f8-9b65-99d5b86c2b22,,,,,,
Create Typical DEER Building from Model,Ruby measure,"Takes a model with space and stub space types, and assigns constructions, schedules, internal loads, hvac, and other loads such as exterior lights and service water heating.Repo: NREL/openstudio-model-articulation-gem",https://bcl.nrel.gov/content/09cc23db-5e9b-4b11-b167-1852a15ed339,,,,,,
Find And Replace In All Thermal Zone Names,Ruby measure,"This measure will find and replace text in all thermal zone names. If the resulting name doesn't represent a unique thermal zone name it won't be changed. The search string must not be empty, but the replace string be empty.Repo: NREL/openstudio-model-articulation-gem",https://bcl.nrel.gov/content/3573d81e-e7de-4949-be50-8abcd0f95a35,,,,,,
Merge Spaces from External File,Ruby measure,The measure lets you merge the contents from spaces in an external file into spaces in your current model. Spaces are identifed by the space name being the same in the two models. If a space is in the current model but not the external model they will be deleted. If a space is in both models the...Repo: NREL/openstudio-model-articulation-gem,https://bcl.nrel.gov/content/e439a1a9-d075-4a25-9f83-2dca79d2826e,,,,,,
AssignSpaceTypeBySpaceName,Ruby measure,Assign space type to spaces with names that include a user defined string. Optionally skip over spaces that already have space types assigned directly to the space.Repo: NREL/openstudio-model-articulation-gem,https://bcl.nrel.gov/content/69ad41bb-cdfe-4a4c-a385-9efaf35b7c27,,,,,,
SetInteriorWallsAndFloorsToAdiabatic,Ruby measure,Set interior walls to Adiabatic and assign a hard construction.Repo: NREL/openstudio-model-articulation-gem,https://bcl.nrel.gov/content/78cbde97-d7c4-425f-ab74-5053a681cc4b,,,,,,
Blended Space Type from Model,Ruby measure,This measure will remove all space type assignemnts and hard assigned internal loads from spaces that are included in the building floor area. Spaces such as plenums and attics will be left alone. A blended space type will be created from the original internal loads and assigned at the building...Repo: NREL/openstudio-model-articulation-gem,https://bcl.nrel.gov/content/667c2f1f-0927-4dbd-a7be-1087b5c15181,,,,,,
Create Bar From DEER Building Type Ratios,Ruby measure,"Creates one or more rectangular building elements based on space type ratios of selected mix of building types, along with user arguments that describe the desired geometry characteristics.Repo: NREL/openstudio-model-articulation-gem",https://bcl.nrel.gov/content/aa4a7ecf-5bfd-4c5e-b0ca-e68babbacff1,,,,,,
Create Bar From Model,Ruby measure,Create a core and perimeter bar envelope based on analysis of initial model geometry.Repo: NREL/openstudio-model-articulation-gem,https://bcl.nrel.gov/content/87fb0783-7a38-4900-8969-40e744c67814,,,,,,
Create Parametric Schedules,Ruby measure,Create parametric schedules for internal loads and HVAC availability. Replace existing schedules in model with newly generated schedules. New schedules along with hours of operation schedule will go in a building level schedule set.Repo: NREL/openstudio-model-articulation-gem,https://bcl.nrel.gov/content/befa8099-c6a7-4045-8792-53fc7124b862,,,,,,
Create Typical DOE Building from Model,Ruby measure,"Takes a model with space and stub space types, and assigns constructions, schedules, internal loads, hvac, and other loads such as exterior lights and service water heating.Repo: NREL/openstudio-model-articulation-gem",https://bcl.nrel.gov/content/b2c80210-33b3-4dfd-8267-535efd81f552,,,,,,
SetExtWallToGroundBoundaryConditionByStory,Ruby measure,Use this to setup one of your building stories as a basement.Repo: NREL/openstudio-model-articulation-gem,https://bcl.nrel.gov/content/a6da6f2b-2d07-4d25-b2b4-4b1dd62df237,,,,,,
SimplifyGeometryToSlicedBar,Ruby measure,"This is an experimental measure looking at ways to simply the geometry, or to create geometry when you only no percentage of space types number of floors and total area. This technique will match the building floor area but will sacrifice the exterior exposure. So it will produce better results...Repo: NREL/openstudio-model-articulation-gem",https://bcl.nrel.gov/content/eb218516-5fa5-47fe-948d-274777c7d592,,,,,,
Space Type and Construction Set Wizard,Ruby measure,"Create DOE space types and or construction sets for the requested building type, climate zone, and target.Repo: NREL/openstudio-model-articulation-gem",https://bcl.nrel.gov/content/7c65af63-4316-47c9-b7a5-68d7a019e533,,Ready,2.0.0,ModelMeasure,src/openstudio_toolkit/tasks/measures/apply_space_type_and_construction_set_wizard.py,NREL/openstudio-model-articulation-gem
Add EMPD Material Properties,Ruby measure,Adds the properties for the effective moisture penetration depth (EMPD) Heat Balance Model with inputs for penetration depths.Repo: NREL/openstudio-model-articulation-gem,https://bcl.nrel.gov/content/91799c24-d81e-42eb-a458-f2b3a0ee1ff3,,,,,,
Blended Space Type from Floor Area Ratios,Ruby measure,"This measure will take a string argument describing the space type ratios, for space types already in the model. There is also an argument to set the new blended space type as the default space type for the building. The space types refererenced by this argument should already exist in the model.Repo: NREL/openstudio-model-articulation-gem",https://bcl.nrel.gov/content/48ff1765-871b-4c9c-9996-a22757c534ad,,,,,,
Clone Building From External Model,Ruby measure,"This measures clones the building in from an external model in place of the existing building in a model. In addition to changing the feilds in the building object itself, it will bring in meters, building story objects, shading surface groups, thermal zones, and spaces. This includes their...Repo: NREL/openstudio-model-articulation-gem",https://bcl.nrel.gov/content/09711168-01a7-4abc-b710-b49d59d927d8,,,,,,
Merge FloorspaceJs with Model,Ruby measure,This measure will import a FloorspacJS JSON file into an OpenStudio model. This is meant to function in similar way to the merge function in the geometry editor of the OpenStudio Applicaiton.Repo: NREL/openstudio-model-articulation-gem,https://bcl.nrel.gov/content/16ef6369-6420-4f17-894c-a767895bcaa4,,,,,,
scale_geometry,Ruby measure,"Scales geometry in the model by fixed multiplier in the x, y, z directions.  Does not guarantee that the resulting model will be correct (e.g. not self-intersecting).Repo: NREL/openstudio-model-articulation-gem",https://bcl.nrel.gov/content/f9cc2ffc-2838-4a18-8330-97e7cc94cdf8,,,,,,
SetNISTInfiltrationCorrelations,Ruby measure,"This measure incorporates infiltration that varies with weather and HVAC operation, and takes into account building geometry (height, above-ground exterior surface area, and volume). It is based on work published by Ng et al. (2018) Repo: NREL/openstudio-model-articulation-gem",https://bcl.nrel.gov/content/b74a4a45-8553-4e94-860f-35b217a04879,,,,,,
CleanupSpaceOrigins,Ruby measure,This measure will move the space origin for all spaces to the origin of bounding box closest to the model origin.Repo: NREL/openstudio-model-articulation-gem,https://bcl.nrel.gov/content/d81f8791-081d-4346-9f27-1b721d27ea86,,,,,,
InjectOsmGeometryIntoAnExternalIdf,Ruby measure,"The goal here is to let people bring an IDF into OpenStudio to add or alter geometry. Then to inject only the geometry back into a copy of the source IDF file, which has never been brought into OpenStudio.Repo: NREL/openstudio-model-articulation-gem",https://bcl.nrel.gov/content/633cd1c5-5b55-4b50-ab20-cf2d2f7ddff8,,,,,,
Rotate Building,Ruby measure,Rotate your building relative to its current orientation. This will not rotate site shading objects.Repo: NREL/openstudio-model-articulation-gem,https://bcl.nrel.gov/content/b2742307-bce7-4747-8f94-977718217305,,,,,,
Set Window to Wall Ratio by Facade,Ruby measure,"This measure will set the window to wall ratio for exterior surfaces with a specified orientation. If one or more windows exist on an affected wall, they will be removed and replaced with a single ribbon window. Doors will not be removed. If the requested ratio can?t be achieved then the wall...Repo: NREL/openstudio-model-articulation-gem",https://bcl.nrel.gov/content/c567a0bf-a7d9-4a06-afe9-bf7df79e6bf8,,,,,,
SurfaceMatching,Ruby measure,This will look for surfaces in adjacent spaces with similar geometry and create thermal connections between them.Repo: NREL/openstudio-model-articulation-gem,https://bcl.nrel.gov/content/e9c69c36-bf33-4ac4-b695-41dee26ee880,,,,,,
Create DOE Prototype Building,Ruby measure,Creates the DOE Reference Building Models as starting points for other analyses.Repo: NREL/openstudio-model-articulation-gem,https://bcl.nrel.gov/content/be90fd0b-a651-467a-bc8d-29d310b0f937,,,,,,
Create and Assign Thermal Zones for Unassigned Spaces,Ruby measure,"If any spaces are not part of a thermal zone, then this measure will create a new thermal zone and assign it to the space.Repo: NREL/openstudio-model-articulation-gem",https://bcl.nrel.gov/content/ddaa752e-5d40-49b2-88de-62e71697e614,,,,,,
DEER Space Type and Construction Set Wizard,Ruby measure,"Create DEER space types and or construction sets for the requested building type, climate zone, and target.Repo: NREL/openstudio-model-articulation-gem",https://bcl.nrel.gov/content/d8effcbd-52b2-4e5c-866c-e85091142aa6,,,,,,
Radiance Daylighting Measure,Ruby measure,This measure uses Radiance instead of EnergyPlus for daylighting calculations with OpenStudio.Repo: NREL/openstudio-model-articulation-gem,https://bcl.nrel.gov/content/1e3cfef8-b051-4e60-8bb0-ed2d29d4f45f,,,,,,
Replace Geometry By Story,Ruby measure,"Test measure to throw away spaces and thermal zones of a completed model, adding in custom footprint for each story, and assigning proper space types, story, and fan exhaust. HVAC will be downstream.Repo: NREL/openstudio-model-articulation-gem",https://bcl.nrel.gov/content/03b18912-0ceb-47e9-8f8b-417a3008e189,,,,,,
Bar Aspect Ratio Study,Ruby measure,"This measure will create a building envelope based on a target floor area, aspect ratio, and floor to floor height.Repo: NREL/openstudio-model-articulation-gem",https://bcl.nrel.gov/content/3dcac94d-8a2e-43b6-8698-a3a4e8f3903f,,,,,,
SetInteriorWallsToSelectedConstruction,Ruby measure,Replace all interior walls with the specified construction.Repo: NREL/openstudio-model-articulation-gem,https://bcl.nrel.gov/content/e3d59d0d-1ce8-4cb2-ae59-001f0fa2ac46,,,,,,
Create Baseline Building,Ruby measure,"Creates the Performance Rating Method baseline building.  For 90.1, this is the Appendix G aka LEED Baseline.  For India ECBC, this is the Appendix D Baseline.  Note: for 90.1, this model CANNOT be used for code compliance; it is not the same as the Energy Cost Budget baseline.Repo: NREL/openstudio-model-articulation-gem",https://bcl.nrel.gov/content/4de56e21-b6cd-45d9-8466-862507d228b2,,,,,,
Create DEER Prototype Building ALPHA Version,Ruby measure,"Creates the DEER Prototype Building Models as starting points for other analyses.  This measure is a work-in-progress ALPHA version.  Some of the building types do not simulate correctly, and no attempt has yet been made to ensure that the simulation results match the DOE-2 DEER Prototypes.Repo: NREL/openstudio-model-articulation-gem",https://bcl.nrel.gov/content/752055bd-10d9-4ede-8a35-18487fedf579,,,,,,
Create Typical Building from Model,Ruby measure,"Takes a model with space and stub space types, and assigns constructions, schedules, internal loads, hvac, and other loads such as exterior lights and service water heating.Repo: NREL/openstudio-model-articulation-gem",https://bcl.nrel.gov/content/339a2e3a-273c-4494-bb50-bfe586a0647c,,,,,,
Make Shading Surfaces Based on Zone Multipliers,Ruby measure,"Initially this will jsut focus on Z shifting of geometry, but in future could work on x,z or y,z multiplier grids like what is use don the large hotelRepo: NREL/openstudio-model-articulation-gem",https://bcl.nrel.gov/content/57d7314d-2ff0-4c13-bf07-b63380bfdea6,,,,,,
Radiant Slab with DOAS,Ruby measure,Adds a radiant slab with DOAS ventilation system to the model.Repo: NREL/openstudio-model-articulation-gem,https://bcl.nrel.gov/content/8091a0c3-7760-4da6-adf4-133d55872816,,,,,,
Create Bar From Building Type Ratios,Ruby measure,"Creates one or more rectangular building elements based on space type ratios of selected mix of building types, along with user arguments that describe the desired geometry characteristics.Repo: NREL/openstudio-model-articulation-gem",https://bcl.nrel.gov/content/6e3a14f8-c3c7-4e03-bc51-bef8a52e1a05,,,,,,
AssignConstructionSetToBuilding,Ruby measure,"This will assign an existing construction set to the building object. This will impact surfaces that don't have construction sets already assigned at story, space type, space, or surfaces with hard assigned constructions.Repo: NREL/openstudio-model-articulation-gem",https://bcl.nrel.gov/content/6e68ddea-2cff-47a3-9daf-f2189e4cf132,,,,,,
AssignSpaceTypeToBuilding,Ruby measure,This will assign a default space type to the building. Optionally you can also remove an exisiting default space typeRepo: NREL/openstudio-model-articulation-gem,https://bcl.nrel.gov/content/05e20922-6fe4-48a4-bddb-411f8167e757,,,,,,
RenameSpaceSurfacesBasedonParentSpaceandOrientation,Ruby measure,"This will rename surfaces so so that they will look like ""Surface MySpace1 wall 230-01"" where ""MySpace1"" is the name of my space ""wall"" is the surface type and 230 is the orientation of the surface and 01 is the first surface of that orientation. SubSurfaces will start with SubSurface instead of...Repo: NREL/openstudio-model-articulation-gem",https://bcl.nrel.gov/content/fee62510-c076-423a-b172-0810ecedba10,,,,,,
Replace Thermostat Schedules,Ruby measure,Replace zone thermostat schedules with other schedules in the same file.  If a zone does not have a thermostat this measure will not add one.Repo: NREL/openstudio-common-measures-gem,https://bcl.nrel.gov/content/7e6da001-30f2-419c-bfc0-2f96ba2115cb,,,,,,
Set Run Period Object,Ruby measure,Set Run Period ObjectRepo: NREL/openstudio-common-measures-gem,https://bcl.nrel.gov/content/6da969e0-4256-49bf-9607-26504cc3d321,,,,,,
SwapLightsDefinition,Ruby measure,This measure will swap out one lights definition for another. All objects that had referred to the original definition will now refer to the new one.Repo: NREL/openstudio-common-measures-gem,https://bcl.nrel.gov/content/63845525-5b86-448f-9a34-6be8481496ea,,,,,,
XcelEDATariffSelectionandModelSetup,Ruby measure,"Add the selected Xcel utility rate, as well as set the timestep and lifecycle costing parameters as required by the Xcel EDA program.Repo: NREL/openstudio-common-measures-gem",https://bcl.nrel.gov/content/c5ab60e9-b8e5-4653-a502-5ed030f1335d,,,,,,
Set Exterior Walls and Floors to Adiabatic,Ruby measure,"Set exterior or ground walls, floors, and roofs to Adiabatic and assign a hard construction. Can specify through bool arguments exterior orientation for walls, as well as floors and roofs.Repo: NREL/openstudio-common-measures-gem",https://bcl.nrel.gov/content/63c7f9ba-8c85-4545-bbc0-d25babefb2c3,,,,,,
Simulation Control,Ruby measure,This measures sets the fields of the SimulationControl object.Repo: NREL/openstudio-common-measures-gem,https://bcl.nrel.gov/content/f0f3eeb6-f23b-4ba9-b0c0-7e680f6f2552,,,,,,
Tariff Selection-Flat,Ruby measure,"This measure sets flat rates for electricity, gas, water, district heating, and district cooling.Repo: NREL/openstudio-common-measures-gem",https://bcl.nrel.gov/content/539c3e8e-6c41-4f50-ac61-6cbbf1ee1b55,,,,,,
Tariff Selection-Generic,Ruby measure,This measure will add pre defined tariffs from IDF files in the resrouce directory for this measure.Repo: NREL/openstudio-common-measures-gem,https://bcl.nrel.gov/content/d65ae535-f0ea-4745-9f5b-8d42c7070741,,,,,,
Add Cost per Floor Area to Unused Lights,Ruby measure,This measure is the same as 'Add Cost per Floor Area to Electric Lights' except that it only offers lights definitions that are not used in the model.Repo: NREL/openstudio-common-measures-gem,https://bcl.nrel.gov/content/a5f5ddcf-48bb-413a-a712-0ee22f0b40a4,,,,,,
Add Output Variable,Ruby measure,This measure adds an output variable at the requested reporting frequency.Repo: NREL/openstudio-common-measures-gem,https://bcl.nrel.gov/content/2a058afb-e349-49ae-a4bf-2c56a42b4352,,,,,,
AddThermalComfortModelTypes,Ruby measure,"Adds to the model (A) any of the available thermal comfort model types, and (B) work efficiency, clothing insulation, and air velocity constant schedules.Repo: NREL/openstudio-common-measures-gem",https://bcl.nrel.gov/content/5ae7b6b3-58d0-40b4-9899-a7cf0e0d36d2,,,,,,
MeterFloodPlot,Ruby measure,This measures generates a flood plot of the requested meter.Repo: NREL/openstudio-common-measures-gem,https://bcl.nrel.gov/content/62940b95-409c-46a7-9328-d3d162b9ee50,,,,,,
Predicted Mean Vote,Ruby measure,This measure adds the necessary data to people objects to support Predicted Mean Vote output data. It also adds the variable request.Repo: NREL/openstudio-common-measures-gem,https://bcl.nrel.gov/content/11cd3144-dac6-4f64-90e4-b8804c6bfc5e,,,,,,
Replace Exterior Window Constructions with a Different Construction from the Model.,Ruby measure,"Replace existing windows with different windows to change thermal or lighting performance.  Window technology has improved drastically over the years, and double or triple-pane high performance windows currently on the market can cut down on envelope loads greatly.  Window frames with thermal...Repo: NREL/openstudio-common-measures-gem",https://bcl.nrel.gov/content/95116deb-0716-4cdc-af27-09c463befc7c,,,,,,
Replace OpenStudio Model,Ruby measure,Repo: NREL/openstudio-common-measures-gem,https://bcl.nrel.gov/content/54f03343-5b5c-42f4-818c-5e6de6ded489,,,,,,
Set COP for Single Speed DX Cooling Units,Ruby measure,This measure will find single speed DX cooling units in the model and will alter the Rated COP to a specified value. It can be run on a single or all air loops in the model.Repo: NREL/openstudio-common-measures-gem,https://bcl.nrel.gov/content/a4a7297e-8314-4df7-86b5-bec18cdd0a3a,,,,,,
SetLifecycleCostParameters,Ruby measure,"This measure sets the analysis type to ""FEMP"" and has an argument for the length of the study period in years.Repo: NREL/openstudio-common-measures-gem",https://bcl.nrel.gov/content/bb5913af-d959-4e2a-81c5-cd0f3d14c99a,,,,,,
XcelEDAReportingandQAQC,Ruby measure,This measure extracts key simulation results and performs basic model QAQC checks necessary for the Xcel EDA Program.Repo: NREL/openstudio-common-measures-gem,https://bcl.nrel.gov/content/92bee759-86ae-4617-92e2-f8e5aa9dc684,,,,,,
Get Site from Building Component Library,Ruby measure,"Populate choice list from BCL, then selected site will be brought into model. This will include the weather file, design days, and water main temperatures.Repo: NREL/openstudio-common-measures-gem",https://bcl.nrel.gov/content/a6dff045-6f62-4288-a3f0-a5549f4c292a,,,,,,
ChangeBuildingLocation,Ruby measure,Change the building locationRepo: NREL/openstudio-common-measures-gem,https://bcl.nrel.gov/content/d4db4971-f5ba-11e3-a3ac-0800200c9a66,,,,,,
Set Multiple Run Period Object,Ruby measure,Set Multiple Run Period ObjectRepo: NREL/openstudio-common-measures-gem,https://bcl.nrel.gov/content/100a5eba-0442-42cb-bdf1-9cf75e102f71,,,,,,
gem environment report,Ruby measure,For OpenStudio testing and development; this measure reports out information about the gem path and gems that are available and loaded.  Used for debugging different runtime environments.Repo: NREL/openstudio-common-measures-gem,https://bcl.nrel.gov/content/3f9f1a2f-0e8a-4c88-b817-10494fc3e73a,,,,,,
Tariff Selection-Block,Ruby measure,"This measure sets block rates for electricity, and flat rates for gas, water, district heating, and district cooling.Repo: NREL/openstudio-common-measures-gem",https://bcl.nrel.gov/content/42e9f831-f39a-4709-a79b-41db49c94f8c,,,,,,
Tariff Selection-Time and Date Dependant,Ruby measure,"This measure sets flat rates for gas, water, district heating, and district cooling but has on seasonal and off peak rates for electricity. It exposes inputs for the time of day and day of year where peak rates should be applied.Repo: NREL/openstudio-common-measures-gem",https://bcl.nrel.gov/content/a890e296-b357-432f-8d53-6428d9bf3c0a,,,,,,
ViewModel,Ruby measure,Visualize an OpenStudio model in a web based viewerRepo: NREL/openstudio-common-measures-gem,https://bcl.nrel.gov/content/f4669f10-fda5-489d-8e1c-7ca3c2d40378,,Ready,2.0.0,ReportingMeasure,src/openstudio_toolkit/tasks/measures/create_view_model_html.py,NREL/openstudio-common-measures-gem
Add Meter,Ruby measure,This measure adds an meter at the requested reporting frequency.Repo: NREL/openstudio-common-measures-gem,https://bcl.nrel.gov/content/ad4015f2-6d1d-4bb2-84b1-db47bc67a5b2,,,,,,
Add Simple PV to Specified Shading Surfaces,Ruby measure,"This measure will add Simple PV objects to site, building or space/zone shading surfaces. This will not create any new geometry, but will just make PV objects out of existing shading geometry. Optionally a cost can be added for the PV.Repo: NREL/openstudio-common-measures-gem",https://bcl.nrel.gov/content/27627c16-75d4-4fc3-add9-2d7d538c0130,,,,,,
EnableIdealAirLoadsForAllZones,Ruby measure,This will enable Ideal Air Loads for all thermal zones in the model. This will result in disconnecting any pre-existing HVAC systems from the zones.Repo: NREL/openstudio-common-measures-gem,https://bcl.nrel.gov/content/f70d4a3d-8b93-4fef-b679-858fe1e05acc,,,,,,
ExportScheduleCSV,Ruby measure,This script exports a CSV file containing values for each schedule in the model at a specified interval.Repo: NREL/openstudio-common-measures-gem,https://bcl.nrel.gov/content/6fc1a46d-4912-47af-8ace-a7c453fbe363,,,,,,
SetEnergyPlusInfiltrationFlowRatePerFloorArea,Ruby measure,Set the flow rate per floor area value for all infiltration objects in the model. Input values are in SI units.Repo: NREL/openstudio-common-measures-gem,https://bcl.nrel.gov/content/490a2af3-7b64-4915-bf9e-9a3a7b525a17,,,,,,
SetEnergyPlusLightObjectsLPD,Ruby measure,Set the LPD for all lights objects in the model. Input values are in SI units.Repo: NREL/openstudio-common-measures-gem,https://bcl.nrel.gov/content/88e02d9f-611f-45ec-afd7-eb9c0e2f8ccf,,,,,,
Set Gas Burner Efficiency,Ruby measure,This measure will find Coil Heating Gas units in the model and will alter the burner efficiency to a specified value. It can be run on a single or all air loops in the model.Repo: NREL/openstudio-common-measures-gem,https://bcl.nrel.gov/content/afabec3d-cd02-4908-a367-84e21657421f,,,,,,
Inject IDF Objects,Ruby measure,This measure allows you to inject IDF objects into an OSM generated IDF prior to passing the IDF off to EnergyPlus.Repo: NREL/openstudio-common-measures-gem,https://bcl.nrel.gov/content/f567dfbc-d280-4d68-b061-019ab2630cd0,,,,,,
Output Table Summary Reports,Ruby measure,"This Measure adds one of the predefined summary table outputs from EnergyPlus to the the Model, which can be helpful for requesting monthly or sizing reports.Repo: NREL/openstudio-common-measures-gem",https://bcl.nrel.gov/content/9edf689e-b0c4-4a80-9d3f-a5b8e9097275,,,,,,
Remove Orphan Objects and Unused Resources,Ruby measure,This is the start of a measure that will have expanded functionality over time. It will have two distinct functions. One will be to remove orphan objects. This will typically include things that should never have been left alone and often are not visible in the GUI. This would include load...Repo: NREL/openstudio-common-measures-gem,https://bcl.nrel.gov/content/c618f299-a245-49ce-a119-82eb54007ede,,,,,,
Add Cost per Floor Area to Building,Ruby measure,"This measure will create life cycle cost objects associated with a the building. You can set a material and installation cost, demolition cost, and O&M costs. Optionally existing cost objects already associated with building can be deleted. This measure will not affect energy use of the building.Repo: NREL/openstudio-common-measures-gem",https://bcl.nrel.gov/content/153992bb-0202-424b-9fbb-57fcf0285e65,,,,,,
Add Cost per Area to Unused Construction,Ruby measure,This measure is the same as 'Add Cost per Area to Construction' except that it only offers constructions that are not used on any surfaces in the baseline construction.Repo: NREL/openstudio-common-measures-gem,https://bcl.nrel.gov/content/ad632782-125f-45c8-a9cf-516e184b418a,,,,,,
ModifyEnergyPlusFanVariableVolumeObjects,Ruby measure,Set the Maximum Flow Rate and and Pressure Rise values for all Fan:VariableVolume objects in the model. Input values are in SI units.Repo: NREL/openstudio-common-measures-gem,https://bcl.nrel.gov/content/009fe4eb-be72-4803-ac84-471ebe2c4c21,,,,,,
Set Lighting Loads by LPD,Ruby measure,Set the lighting power density (W/ft^2) in the to a specified value for all spaces that have lights. This can be applied to the entire building or a specific space type. Cost can be added per floor areaRepo: NREL/openstudio-common-measures-gem,https://bcl.nrel.gov/content/901c076e-02af-4bf4-a780-57391e7b1e2a,,,,,,
