Name,Type,Description,Link,Functional Category,Status,OS Min Compatible,Measure Type,Toolkit Wrapper,Source Repo
AedgSmallToMediumOfficeSlabAndBasement,Ruby measure,"This measure applies Small to Medium Office AEDG 50% recommendations for slab and below grade walls. It can also be used to model and simulate ASHRAE 90.1 2004 slab and below grade wall insulation levels. Note that for many climate zones (1-3), if your model doesn't have below grade walls or...Repo: NREL/openstudio-aedg-gem",https://bcl.nrel.gov/content/9ef02e15-c7af-4bd3-a98a-44d52f3ea385,,,,,,
ZEDG K12 RoofConstruction,Ruby measure,"ZEDG version, only setup for IEAD roof. This measure will modify existing roof insulation levels and Solar Reflective Index (SRI) values based on roof type and climate zone. The roof type and climate zone should be set in the model prior to using this measure. If your model uses an attic, all...Repo: NREL/openstudio-aedg-gem",https://bcl.nrel.gov/content/d322d264-5855-4b20-bd3e-3c5e5032bc05,,,,,,
AedgK12ExteriorLighting,Ruby measure,"This measure will create exterior lights objects in four different categories described below. The lighting levels and controls will be based on the ""How to Implement Recommendations"" section in the AEDG; any existing exterior lighting will be removed. A special input is needed for this measure...Repo: NREL/openstudio-aedg-gem",https://bcl.nrel.gov/content/04fd62eb-3e9f-4bfc-98d8-7827b47e034a,,,,,,
AedgK12HvacDualDuctDoas,Ruby measure,"Measure replaces existing HVAC system (if any) with a Dual Duct with DOAS HVAC system (one system per floor).  The dual duct system (separate variable speed air delivery paths for cooling and DOAS, with zone level heating) is applied to all space types except Cafeteria, Kitchen, Gym, and...Repo: NREL/openstudio-aedg-gem",https://bcl.nrel.gov/content/e45f7185-15c2-40da-be15-2e8406f96dba,,,,,,
AedgK12HvacFanCoilDoas,Ruby measure,"Measure replaces existing HVAC system (if any) with a Fan Coil with DOAS HVAC system (one DOAS per floor).  The fan coil with DOAS system (centralized DOAS, with zone level conditioning) is applied to all space types except Cafeteria, Kitchen, Gym, and Auditorium; packaged single zone equipment...Repo: NREL/openstudio-aedg-gem",https://bcl.nrel.gov/content/ed4da36e-5b88-4cce-9ee2-c5390031dd61,,,,,,
AedgK12HvacGshpDoas,Ruby measure,"Measure replaces existing HVAC system (if any) with a Ground Source Heat Pump (GSHP) with DOAS HVAC system (one DOAS per floor).  The GSHP with DOAS system (centralized DOAS, with zone level conditioning) is applied to all space types except Cafeteria, Kitchen, Gym, and Auditorium; packaged...Repo: NREL/openstudio-aedg-gem",https://bcl.nrel.gov/content/b8ba0b97-9caf-42cd-81bb-16eaa0a4402c,,,,,,
AedgK12RoofConstruction,Ruby measure,"This measure will modify existing roof insulation levels and Solar Reflective Index (SRI) values based on roof type and climate zone. The roof type and climate zone should be set in the model prior to using this measure. If your model uses an attic, all attic surfaces should have an ""Attic'...Repo: NREL/openstudio-aedg-gem",https://bcl.nrel.gov/content/04f0c955-4885-4974-9930-13601f375d20,,,,,,
AedgSmallToMediumOfficeExteriorDoorConstruction,Ruby measure,This measure is intended for use on opaque doors; if doors are glass they should be treated as windows. OpenStudio does have a unique object for overhead doors versus standard doors. This measure doesn't alter infiltration. There is a separate measure for infiltration that includes user...Repo: NREL/openstudio-aedg-gem,https://bcl.nrel.gov/content/d9dd27f7-d622-4d85-96e4-c09fcd15603c,,,,,,
AedgSmallToMediumOfficeExteriorFloorConstruction,Ruby measure,This measure will modify existing exterior floor (air exposed) insulation levels based on construction type and climate zone. The exterior floor construction type and climate zone should be set in the model prior to using this measure. For mass floors if an existing insulation layer can be found...Repo: NREL/openstudio-aedg-gem,https://bcl.nrel.gov/content/6698017c-52bd-4fc9-9240-f480301f66b8,,,,,,
AedgSmallToMediumOfficeRoofConstruction,Ruby measure,"This measure will modify existing roof insulation levels and Solar Reflective Index (SRI) values based on roof type and climate zone. The roof type and climate zone should be set in the model prior to using this measure. If your model uses an attic, all attic surfaces should have an ""Attic'...Repo: NREL/openstudio-aedg-gem",https://bcl.nrel.gov/content/f35d0cf1-40e4-47d1-84a4-91181a03085e,,,,,,
ZEDG K12 Interior Lighting,Ruby measure,"This measure removes all existing electric equipment objects from spaces recognized as primary or secondary school space types, with the exception of the kitchen which has a dedicated measure that should be used. New equipment will be added based on the Net Zero K12 recommendations.Repo: NREL/openstudio-aedg-gem",https://bcl.nrel.gov/content/d3283a8e-aee1-4b9d-9217-a7a988726fb4,,,,,,
AedgK12ExteriorDoorConstruction,Ruby measure,This measure is intended for use on opaque doors; if doors are glass they should be treated as windows. OpenStudio does have a unique object for overhead doors versus standard doors. This measure doesn't alter infiltration. There is a separate measure for infiltration that includes user...Repo: NREL/openstudio-aedg-gem,https://bcl.nrel.gov/content/87718175-d555-4936-b2f6-a381208341e9,,,,,,
AedgK12ExteriorFloorConstruction,Ruby measure,This measure will modify existing exterior floor (air exposed) insulation levels based on construction type and climate zone. The exterior floor construction type and climate zone should be set in the model prior to using this measure. For mass floors if an existing insulation layer can be found...Repo: NREL/openstudio-aedg-gem,https://bcl.nrel.gov/content/099f148c-7550-45ac-bbfe-0eb2bac5969f,,,,,,
AEDG K12 - Fenestration and Daylighting Controls,Ruby measure,"This measure will remove all existing exterior windows, glass doors, and skylights from your model. They will be replaced with view and daylight windows as recommended by the K12 AEDG recommendations. Windows on the south facade will have a exterior shading or light shelf surfaces depending on...Repo: NREL/openstudio-aedg-gem",https://bcl.nrel.gov/content/76683121-d531-46c0-8e1c-749c1ff646f0,,,,,,
AedgK12Kitchen,Ruby measure,"Measure replaces existing kitchen equipment (if any) with refrigeration, electric, and gas equipment that align with the kitchen equipment recommendations of the 50% K-12 AEDG.Repo: NREL/openstudio-aedg-gem",https://bcl.nrel.gov/content/92750b5a-7eb5-4df5-899f-c186c7c27935,,,,,,
AedgOfficeHvacFanCoilDoas,Ruby measure,"Measure replaces existing HVAC system (if any) with a Fan Coil with DOAS HVAC system (one DOAS per floor).  The fan coil with DOAS system (centralized DOAS, with zone level conditioning) is applied to all space types.  In select cases, the user is given the option to preserve existing HVAC...Repo: NREL/openstudio-aedg-gem",https://bcl.nrel.gov/content/298c5638-bd9d-4d6a-9c8a-e0514df4db4a,,,,,,
AedgOfficeHvacRadiantDoas,Ruby measure,"Measure replaces existing HVAC system (if any) with a Radiant Heating and Cooling with DOAS HVAC system (one DOAS per floor).  The radiant with DOAS system (centralized DOAS, with zone level conditioning) is applied to all space types.  In select cases, the user is given the option to preserve...Repo: NREL/openstudio-aedg-gem",https://bcl.nrel.gov/content/3d7edb7b-aeff-4a59-87f2-138766b48c11,,,,,,
AedgSmallToMediumOfficeElectricEquipment,Ruby measure,This measure removes all existing electric equipment from spaces recognized as office building space types. New electric objects will be added based on the 50% Small to Medium Office AEDG recommendations.Repo: NREL/openstudio-aedg-gem,https://bcl.nrel.gov/content/2b50c112-4ee3-42b2-8c7f-d76d752cd0b4,,,,,,
AedgSmallToMediumOfficeFenestrationAndDaylightingControls,Ruby measure,"This measure will remove all existing exterior windows, glass doors, and skylights from your model. They will be replaced with view and daylight windows as recommended by the Small to Medium Office AEDG recommendations. Windows on the south facade will have a exterior shading or light shelf...Repo: NREL/openstudio-aedg-gem",https://bcl.nrel.gov/content/4252d6c7-ccd5-4cae-b55e-8d7b1dfcc717,,,,,,
ZEDG K12 HVAC Fan Coil DOAS,Ruby measure,"Measure replaces existing HVAC system (if any) with a Fan Coil with DOAS HVAC system (one DOAS per floor).  The fan coil with DOAS system (centralized DOAS, with zone level conditioning) is applied to all space types except Cafeteria, Kitchen, Gym, and Auditorium; packaged single zone equipment...Repo: NREL/openstudio-aedg-gem",https://bcl.nrel.gov/content/791d0da9-00d3-422f-9dd2-fe57c9b59997,,,,,,
ZEDG K12 HVAC Fan Coil DOAS Air Cooled Chiller,Ruby measure,Measure replaces existing HVAC system (if any) with a Fan Coil with DOAS HVAC with air cooled Chiller system (one DOAS per floor).Repo: NREL/openstudio-aedg-gem,https://bcl.nrel.gov/content/33ed4338-5e86-415f-8df0-87e32e413711,,,,,,
AedgK12InteriorFinishes,Ruby measure,"This measure will adjust the visible reflectance of materials used on interior building surfaces. Different target values will be set for floors, ceilings, and furniture/interior partition surfaces.Repo: NREL/openstudio-aedg-gem",https://bcl.nrel.gov/content/9165a1f8-9cd1-4492-b20b-5257c05fc5d9,,,,,,
AedgK12InteriorLightingControls,Ruby measure,This measure reduces the values associated with lighting schedules to simulate reductions due to vacancy sensors throughout the building.Repo: NREL/openstudio-aedg-gem,https://bcl.nrel.gov/content/9f395ee4-5f82-4ca6-8a50-cb854893827e,,,,,,
AedgSmallToMediumOfficeEnvelopeAndEntryInfiltration,Ruby measure,This measure addresses two sources of air infiltration. The first is infiltration through the building envelope. The second is infiltration due to occupants entering and leaving the building. The AEDG provides recommendations and tips on how to limit infiltration in both cases. For occupant...Repo: NREL/openstudio-aedg-gem,https://bcl.nrel.gov/content/9c977bfb-d3f8-4f61-afcf-9524edf82cb8,,,,,,
AedgSmallToMediumOfficeExteriorLighting,Ruby measure,"This measure will create exterior lights objects in four different categories described below. The lighting levels and controls will be based on the ""How to Implement Recommendations"" section in the AEDG; any existing exterior lighting will be removed. A special input is needed for this measure...Repo: NREL/openstudio-aedg-gem",https://bcl.nrel.gov/content/90211a9c-de3f-458d-85c1-b40666b55f06,,,,,,
AedgSmallToMediumOfficeExteriorWallConstruction,Ruby measure,This measure will modify existing exterior wall insulation levels based on construction type and climate zone. The exterior wall construction type and climate zone should be set in the model prior to using this measure. For mass and metal walls if an existing insulation layer can be found it...Repo: NREL/openstudio-aedg-gem,https://bcl.nrel.gov/content/736836f8-1a55-47a6-96b7-9fd157be6744,,,,,,
AedgSmallToMediumOfficeInteriorLighting,Ruby measure,This measure removes all existing lighting objects from spaces recognized as primary or secondary school space types. New lighting will be added based on the 50% Small to Medium Office AEDG recommendations.Repo: NREL/openstudio-aedg-gem,https://bcl.nrel.gov/content/e1e16b8f-5cbf-447c-9f76-7fe69b3cf01e,,,,,,
ZEDG K12 ElectricEquipment,Ruby measure,"This measure removes all existing electric equipment from spaces recognized as primary or secondary school space types. One exception is that loads assigned directly to a space where the load definition contains ""Elev"" or ""elev"" will be left alone. New electric equipment will be added based on...Repo: NREL/openstudio-aedg-gem",https://bcl.nrel.gov/content/d1fc10bc-0ae1-4e1b-b1ac-67fc3923b268,,,,,,
ZEDG K12 ExteriorDoorConstruction,Ruby measure,This measure is intended for use on opaque doors; if doors are glass they should be treated as windows. OpenStudio does have a unique object for overhead doors versus standard doors. This measure doesn't alter infiltration. There is a separate measure for infiltration.Repo: NREL/openstudio-aedg-gem,https://bcl.nrel.gov/content/11c69bb4-3bea-4a7e-8a8e-fea4b5f71a1c,,,,,,
ZEDG K12 ExteriorWallConstruction,Ruby measure,"This measure will modify existing exterior wall insulation levels based on construction type and climate zone. The climate zone should be set in the model prior to using this measure. For steel and wood framed walls, insulation will be added to the exterior of the construction.Repo: NREL/openstudio-aedg-gem",https://bcl.nrel.gov/content/39d1c328-0bbb-40ee-a18c-ba977b462a11,,,,,,
ZEDG K12 Kitchen,Ruby measure,Electric equipment added per ZEDG recommendations for kitchens. Refrigeration is included in the plug loads.Repo: NREL/openstudio-aedg-gem,https://bcl.nrel.gov/content/6d9f212d-e859-4857-8ee7-1670de9c2bfb,,,,,,
ZEDG K12 SWH,Ruby measure,Use 90% efficient natural gas-fired storage tank water heater. Water use demand is caluclated per student.Repo: NREL/openstudio-aedg-gem,https://bcl.nrel.gov/content/d765082f-34fb-4b03-bd4e-e8e4a418ba2a,,,,,,
AedgK12InteriorLighting,Ruby measure,"This measure removes all existing electric equipment objects from spaces recognized as primary or secondary school space types, with the exception of the kitchen which has a dedicated measure that should be used. New equipment will be added based on the 50% K12 AEDG recommendations.Repo: NREL/openstudio-aedg-gem",https://bcl.nrel.gov/content/2faf0e50-8589-427f-8ee8-928169b1f7fa,,,,,,
AedgK12SlabAndBasement,Ruby measure,"This measure applies K12 AEDG 50% recommendations for slab and below grade walls. It can also be used to model and simulate ASHRAE 90.1 2004 slab and below grade wall insulation levels. Note that for many climate zones (1-5), if your model doesn't have below grade walls or heated slabs the AEDG...Repo: NREL/openstudio-aedg-gem",https://bcl.nrel.gov/content/589fcda1-049e-44c5-82e4-804d7d9165aa,,,,,,
AedgOfficeHvacVavDx,Ruby measure,"Measure replaces existing HVAC system (if any) with a high efficiency multizone variable air volume (VAV) HVAC system (one system per floor).  The multizone VAV system (centralized cooling with zone level heating) is applied to all space types.  In select cases, the user is given the option to...Repo: NREL/openstudio-aedg-gem",https://bcl.nrel.gov/content/ffdf05ce-34c2-498e-9ca8-4ef8fe3a9af5,,,,,,
AedgSmallToMediumOfficeElectricEquipmentControls,Ruby measure,"This measure reduces the values associated with electric equipment schedules to simulate reductions due to equipment controls throughout the building. This includes occupancy based outlets or adapters, as well as network or timer based controls.Repo: NREL/openstudio-aedg-gem",https://bcl.nrel.gov/content/b297ea8a-d21f-416b-8b41-3dfc99b430cf,,,,,,
AedgSmallToMediumOfficeInteriorFinishes,Ruby measure,"This measure will adjust the visible reflectance of materials used on interior building surfaces. Different target values will be set for floors, ceilings, and furniture/interior partition surfaces.Repo: NREL/openstudio-aedg-gem",https://bcl.nrel.gov/content/d426daf2-995d-4c76-bec4-4b34e7ae2f38,,,,,,
ZEDG K12 Envelope Infiltration,Ruby measure,This measure addresses total building infiltration values.Repo: NREL/openstudio-aedg-gem,https://bcl.nrel.gov/content/e6232b68-8c72-4986-8693-84c0fe1d00ec,,,,,,
ZEDG K12 - Fenestration and Daylighting Controls,Ruby measure,"This measure will remove all existing exterior windows, glass doors, and skylights from your model. They will be replaced with view and daylight windows as recommended by the Net Zero K12 recommendations. Windows on the south facade will have a exterior shading or light shelf surfaces depending...Repo: NREL/openstudio-aedg-gem",https://bcl.nrel.gov/content/eb3bfd3d-64b6-4a9f-857d-3dd8a7becec5,,,,,,
ZEDG K12 HVAC GSHP with DOAS,Ruby measure,"Each zone served by the DOAS (classrooms, corridors, library/media center, lobbies, mechanical rooms, offices, and restrooms) was modeled with a two-speed GSHP.Repo: NREL/openstudio-aedg-gem",https://bcl.nrel.gov/content/59793426-1d07-41d2-9478-d7abf1410764,,,,,,
Meter Custom,Ruby measure,"This measure creates a Custom Meter to combine output variables and meters from a user-defined .csv file. This is helpful for combining energy use by floor, by space type, or for specific zones. You can easily create this grouping by generating the SpaceTypeReport, then filtering and copying the...Repo: BuildingPerformanceSimulation/openstudio-measures",https://bcl.nrel.gov/content/4b323dbc-652b-447f-a883-fbdc9f2e651b,,,,,,
Edit Return Air Flow Fraction,Ruby measure,This modifies the Design Return Air Flow Fraction of Supply Air Flow from the default of 1 for cases where the system return fan never returns as much airflow as the supply fan.Repo: Ski90Moo/OpenStudio_Measures_HEPLLC,https://bcl.nrel.gov/content/3163802d-596c-4d9c-b054-72a44dc8e103,,,,,,
Zone Report,Ruby measure,"This measure provides Thermal Zone level HVAC information.  Output includes thermal zone equipment descriptions and details, zone sizing information for heating and cooling, and a disaggregation of the contributions of envelope and internal gains to the HVAC loads.Repo: BuildingComponentLibrary/legacy-NREL-measures-gem",https://bcl.nrel.gov/content/f3531642-27ce-4624-95ab-0bfcd5b9f5fe,,,,,,
OpenStudio Extension Test Measure,Ruby measure,A measure that tests OpenStudio Extension gem functionalityRepo: BuildingComponentLibrary/legacy-NREL-measures-gem,https://bcl.nrel.gov/content/36b99a29-41e1-4d85-9272-85d43b966e5a,,,,,,
Add Wind and Stack Open Area,Ruby measure,"This measure models natural ventilation to thermal zones with operable windows.  It is not intended to model natural ventilation that relies on interzone, stack driven air transfer.Repo: BuildingPerformanceSimulation/openstudio-measures",https://bcl.nrel.gov/content/8055497a-0d38-48eb-a643-76383fa54664,,,,,,
Surface Matching Diagnostic,Ruby measure,This will look for surfaces in adjacent spaces with similar geometry and create thermal connections between them.Repo: BuildingPerformanceSimulation/openstudio-measures,https://bcl.nrel.gov/content/ffb0d487-eb1c-4ca4-b008-4fbb7bf511b2,,,,,,
Ideal Loads Options,Ruby measure,"This measure allows the user to edit ideal air loads fields including availability schedules, maximum and minimum supply air temperatures, humidity ratios and flow rates, humidity control, outdoor air requirements, demand controlled ventilation, economizer operation, and heat recovery.Repo: BuildingPerformanceSimulation/openstudio-measures",https://bcl.nrel.gov/content/ae756607-68ba-4615-87df-a0870beede98,,,,,,
Add Interval Schedule From File,Ruby measure,This measure adds a schedule object from a file of interval dataRepo: BuildingPerformanceSimulation/openstudio-measures,https://bcl.nrel.gov/content/b3ff0a0f-16a4-4abf-9574-c3605846637e,,,,,,
Set Output Table To IP Units,Ruby measure,This measure changes the output table to be in IP units.Repo: BuildingPerformanceSimulation/openstudio-measures,https://bcl.nrel.gov/content/c4381bc7-2426-486a-8050-e50c60e718a2,,,,,,
Remove HVAC Systems,Ruby measure,This measure removes HVAC systems from an OpenStudio model.Repo: BuildingPerformanceSimulation/openstudio-measures,https://bcl.nrel.gov/content/169c5b60-6490-4096-8003-7d15090419a9,,,,,,
Split Windows Into Horizontal Segments,Ruby measure,This will replace all exterior rectangular windows with a series of stacked horizontal segments of the same area. The number of segments is determined by a user argument. Note that the resulting windows are adjacent and may result in odd behavior in various interfaces that expect sub surfaces to...Repo: BuildingPerformanceSimulation/openstudio-measures,https://bcl.nrel.gov/content/a385738c-2e04-4c94-9826-72c28e2a8d53,,,,,,
Add Hourly Meters,Ruby measure,This measure adds hourly meters for the most common energy use types.Repo: BuildingPerformanceSimulation/openstudio-measures,https://bcl.nrel.gov/content/2ee535a3-90cd-4f87-9bc8-bdf31b4d12b9,,,,,,
Swap Construction In Construction Set,Ruby measure,This will swap a construction assigned in any construction set with another defined in your model. This will make the change in all construction sets.Repo: BuildingPerformanceSimulation/openstudio-measures,https://bcl.nrel.gov/content/f2dd07a6-51e8-4c66-b814-861f3b0ee678,,,,,,
Rename Air Loop Objects By Air Loop Name,Ruby measure,"This measure will rename node, fan, and outdoor air system objects from a generic name  ""Node 10"" to the air loop name and type of object  ""AHU 1 Supply Air Node"".  This is helpful when investigating air loop controls and operation in outdoor variables.Repo: BuildingPerformanceSimulation/openstudio-measures",https://bcl.nrel.gov/content/3c4592ac-7b89-4623-8c77-55d632c4d10d,,,,,,
Add Waterside Economizer,Ruby measure,This measure adds a waterside economizer to provide free cooling to a user-selected chilled water loop from a user-selected condenser water loop when the outdoor wetbulb temperature is low enough.Repo: BuildingPerformanceSimulation/openstudio-measures,https://bcl.nrel.gov/content/a16cc194-2275-4556-99ec-0d42e84960cf,,,,,,
Assign Zones to Air Loop from CSV,Ruby measure,This measure adds thermal zones and air terminals to an air loop from a user-defined .csv file.Repo: BuildingPerformanceSimulation/openstudio-measures,https://bcl.nrel.gov/content/d156658b-747b-4722-aeed-17b856f09d3f,,,,,,
Change Variable Volume Fan Coefficients,Ruby measure,This measure changes the variable speed fan coefficients to model fan systems with different characteristics and static pressure reset controls.Repo: BuildingPerformanceSimulation/openstudio-measures,https://bcl.nrel.gov/content/c670986e-d20b-4254-9ffa-7495704b30a5,,,,,,
Rename VRF Terminal,Ruby measure,"New new is combination of VRF system name and thermal zone name. This doesn't change the performance of the system in any way, just the name of VRF terminal objectsRepo: BuildingPerformanceSimulation/openstudio-measures",https://bcl.nrel.gov/content/94b4d3dc-719d-4957-8fb7-1590d7042503,,,,,,
Get Lat Long from ground exposed floors,Ruby measure,This is quick utility to gather geometry needed for geojsonRepo: BuildingPerformanceSimulation/openstudio-measures,https://bcl.nrel.gov/content/6f98a732-4826-4905-ab72-e7e081f77325,,,,,,
Report Effective Number of Spaces and Avg Space Size per space type,Ruby measure,"Quick measure to report the effective number of spaces, along with average and total floor area for each space type..Repo: BuildingPerformanceSimulation/openstudio-measures",https://bcl.nrel.gov/content/594a324e-156a-493c-93fb-0cbc0d15509e,,,,,,
Set Building To Construction Set,Ruby measure,This measures changes the building's default construction set to one selected by the user from a list of available default construction sets.Repo: BuildingPerformanceSimulation/openstudio-measures,https://bcl.nrel.gov/content/718d27f6-02f6-4306-8b9a-07d13b126376,,,,,,
Set Zone Height Volume and Area,Ruby measure,"This coudl be used anytime you want to overwrite the calculated values, but it was specifically designe for pinwheel model where there only exterior surfaces associated to the thermal zones.Repo: BuildingPerformanceSimulation/openstudio-measures",https://bcl.nrel.gov/content/64cbdf8e-a6d0-41ee-8bbe-909bf975db3e,,,,,,
ChangeTheRoomType,Ruby measure,Take stratification into accountRepo: BuildingPerformanceSimulation/openstudio-measures,https://bcl.nrel.gov/content/7e1b4317-8488-44fa-bb55-cdf3867292ed,,,,,,
life_cycle_cost_report,Ruby measure,Lists all LifeCycle Cost objects in the model as well as the LifeCycle Cost Parameter objectRepo: BuildingComponentLibrary/legacy-NREL-measures-gem,https://bcl.nrel.gov/content/ae699b16-e6e9-4d8d-acd7-4ed4c51a7239,,,,,,
obj_exporter,Ruby measure,Exports the OpenStudio model in Wavefront OBJ format for viewing in common 3D engines.  One free viewer is available at http://www.open3mod.com/.Repo: BuildingComponentLibrary/legacy-NREL-measures-gem,https://bcl.nrel.gov/content/cb9bde0a-3b21-486b-b451-2455d2539ccc,,,,,,
