Name,Type,Description,Link,Functional Category,Status,OS Min Compatible,Measure Type,Toolkit Wrapper,Source Repo
Add EMS to Report Emissions,Ruby measure,"This measure reports emissions based on user-provided future and historical years as well as future, historical hourly, and historical annual subregions.Repo: NREL/openstudio-common-measures-gem",https://bcl.nrel.gov/content/e8fe9153-5e70-4769-afa0-6da0045aa529,,,,,,
Add EMS to Control EV Charging,Ruby measure,This measure implements a control system to curtail an electric vehicle (EV) charging load to better align EV charging with expected energy production from a solar PV system.Repo: NREL/openstudio-common-measures-gem,https://bcl.nrel.gov/content/df97997f-d02a-4e35-af7a-5aed16cb5772,,,,,,
Add Rooftop PV,Ruby measure,"This measure will create new shading surface geometry above the roof for each thermal zone inyour model where the surface azmith falls within the user specified range. Arguments are exposed for panel efficiency, inverter efficiency, and the fraction of each roof surface that has PV.Repo: NREL/openstudio-common-measures-gem",https://bcl.nrel.gov/content/34550614-0c87-44db-9252-0ca0915b1e64,,,,,,
Add Zone Mixing Object,Ruby measure,"This adds a zone mixing object with a few inputs exposed, including source zone. You can add multiple copies of this to the workflow as needed.Repo: NREL/openstudio-common-measures-gem",https://bcl.nrel.gov/content/6ed65817-1d97-43da-a4c2-1d738eafcde5,,,,,,
CreateCSVOutput,Ruby measure,Create CSV output for output variables in SQL fileRepo: NREL/openstudio-common-measures-gem,https://bcl.nrel.gov/content/99d3a7e5-4bd5-407f-b5eb-7c59660ca980,,,,,,
Set Electric Equipment loads by EPD,Ruby measure,Set the electric equipment power density (W/ft^2) in the to a specified value for all spaces that have electric equipment. This can be applied to the entire building or a specific space type. Cost can be added per floor areaRepo: NREL/openstudio-common-measures-gem,https://bcl.nrel.gov/content/b1d87b95-a6d1-4999-bd0d-16da879f4340,,,,,,
ViewData,Ruby measure,Visualize energy simulation data plotted on an OpenStudio model in a web based viewerRepo: NREL/openstudio-common-measures-gem,https://bcl.nrel.gov/content/18cf0de7-48b8-48dc-ab68-0dd29f0b8bd0,,,,,,
Add Cost per Area to Construction,Ruby measure,"This measure will create life cycle cost objects associated with the selected construction. You can set a material and installation cost, demolition cost, and O&M costs. Optionally existing cost objects already associated with building can be deleted. This measure will not affect energy use of...Repo: NREL/openstudio-common-measures-gem",https://bcl.nrel.gov/content/bf6ac5d5-6348-4012-b7b4-1200a672e377,,,,,,
Add Cost per FloorArea to Lights,Ruby measure,"This measure will create life cycle cost objects associated with lights. You can choose any light definition used in the model that has a watt/area power. You can set a material & installation cost, demolition cost, and O&M costs. Optionally existing cost objects already associated with the...Repo: NREL/openstudio-common-measures-gem",https://bcl.nrel.gov/content/eeec5adf-b3a8-498a-b0d1-eabd81ca0620,,,,,,
Add Cost to Supply Side HVAC Component by Air Loop,Ruby measure,This will add cost to HVAC components of a specified type in the selected air loop(s). It can run on all air loops or a single air loop. This measures only adds cost and doesn't alter equipment performanceRepo: NREL/openstudio-common-measures-gem,https://bcl.nrel.gov/content/a667a52f-aa04-4997-9292-c81671d75f84,,,,,,
Adjust Thermostat Setpoints by Degrees,Ruby measure,This measure adjusts heating and cooling setpoints by a user specified number of degrees. This is applied throughout the entire building.Repo: NREL/openstudio-common-measures-gem,https://bcl.nrel.gov/content/6e1f34f9-92e1-44ea-9279-de0b9b64f6a1,,,,,,
Set Space Infiltration by Exterior Surface Area,Ruby measure,"Replace all Space Infiltration objects with a new one that has a prescribed flow rate per exterior surface area.  There are many strategies that can be used to reduce infiltration.
Seal Windows ? Seal all windows and doors with weather strip and fill any air gaps with insulation and...Repo: NREL/openstudio-common-measures-gem",https://bcl.nrel.gov/content/9d7b0789-3974-4869-a2a8-055391857e3c,,,,,,
Set Thermostat Schedules,Ruby measure,Sets zone thermostat schedules to schedules in the same file. If a zone does not have a thermostat this measure will add oneRepo: NREL/openstudio-common-measures-gem,https://bcl.nrel.gov/content/2978cde0-53d5-4096-bdab-11f9f6e074f1,,,,,,
Unmet Load Hours Troubleshooting,Ruby measure,"Unmet load hours are any hours of operation when conditioned spaces are outside the throttling range for heating or cooling controls. That is, they are the hours in a year that the HVAC system serving a space cannot maintain space setpoint. This measure performs a series of checks against...Repo: NREL/openstudio-common-measures-gem",https://bcl.nrel.gov/content/edf8fc3a-5607-4e0f-9dd2-4a1e1545433b,,,,,,
Add_EV_Load,Ruby measure,"This measure adds a load associated with charging of electric vehicles (EVs) to a building in URBANopt. EV load profiles were generated in EVI-Pro for specific building types. This measure allows running of customized load profiles for buildings in the Pena Station Next project, and also for...Repo: NREL/openstudio-common-measures-gem",https://bcl.nrel.gov/content/a23e0493-7357-48ca-b089-4d902efd6b50,,,,,,
Air Wall Zone Mixing,Ruby measure,This measure replaces conductive heat transfer with zone mixing wherever air walls are used on matched surfaces or sub-surfaces for walls. A user argument is exposed for a coefficient that represents a target air changes per hour (ACH) for a room where the zone volume/the air wall surface area...Repo: NREL/openstudio-common-measures-gem,https://bcl.nrel.gov/content/fd04f73e-a530-4144-9e1e-c1878b1394bc,,,,,,
Add Cost per Floor Area to Electric Equipment,Ruby measure,"This measure will create life cycle cost objects associated with electric equipment. You can choose any electric equipment definition used in the model that has a watt/area power. You can set a material and installation cost, demolition cost, and O&M costs. Optionally existing cost objects...Repo: NREL/openstudio-common-measures-gem",https://bcl.nrel.gov/content/42cf1acc-c0bc-46cd-af67-8a17cadaab7b,,,,,,
Add Exterior Lights,Ruby measure,Add exterior lighting to the building.  This may be in addition to or in place of existing exterior lighting.  This lighting will run from sunset to sunrise. Optionally you can add costs to the lights.Repo: NREL/openstudio-common-measures-gem,https://bcl.nrel.gov/content/34f9050c-5f8f-4d10-8e46-30ca8333114d,,,,,,
AdjustSystemEfficiencies,Ruby measure,Updates heating and cooling efficiencies of all equipment in a model by a multiplier.Repo: NREL/openstudio-common-measures-gem,https://bcl.nrel.gov/content/edeaff3d-3ae4-4487-b4a4-5cf08ea14510,,,,,,
ModifyEnergyPlusCoilCoolingDXSingleSpeedObjects,Ruby measure,Set various values for existing CoilCoolingDXSingleSpeed objects. Input values are in SI units.Repo: NREL/openstudio-common-measures-gem,https://bcl.nrel.gov/content/b224bd36-213e-4b0e-b3fe-70371e04533d,,,,,,
RemoveInternalLoadsDirectlyAssignedToSpaces,Ruby measure,"This will removed all internal loads assigned directly to spaces. This can be useful if your model started as an IDF, and now you want to assign space types.Repo: NREL/openstudio-common-measures-gem",https://bcl.nrel.gov/content/019999e0-3e0c-4a77-abbf-a3352de12384,,,,,,
RemoveUnusedDefaultProfiles,Ruby measure,This measure will remove unused default profiles that existed in some older OpenStudio templates. It will remove some EnergyPlus warnings that had appeared in the past.Repo: NREL/openstudio-common-measures-gem,https://bcl.nrel.gov/content/8abcdf38-c391-465a-8fb8-b243aa4f0b06,,,,,,
ReportModelChanges,Ruby measure,"This measure takes the path to an external OSM file.  When it runs, it compares that model to the current model and reports differences between the two.Repo: NREL/openstudio-common-measures-gem",https://bcl.nrel.gov/content/6d66b426-908f-4528-9fe5-523b9d2f49c5,,,,,,
Ventilation Report,Ruby measure,This measure asks the user to select a thermal zone (or all zones) and generates a Quality Assurance Report relating to ventilation and infiltration model objects. The QA report consists of two sections: 1) A table listing each space and associated (total of space) ventilation and infiltration...Repo: NREL/openstudio-common-measures-gem,https://bcl.nrel.gov/content/cb13be0e-88f6-494c-b3b1-dc748b42e205,,,,,,
Zone Report,Ruby measure,"This measure provides Thermal Zone level HVAC information.  Output includes thermal zone equipment descriptions and details, zone sizing information for heating and cooling, and a disaggregation of the contributions of envelope and internal gains to the HVAC loads.Repo: NREL/openstudio-common-measures-gem",https://bcl.nrel.gov/content/81ac119f-4841-434c-9e11-824310fe1cb7,,,,,,
SetRunPeriod,Ruby measure,Sets the run period and timestep for simulationRepo: NREL/openstudio-common-measures-gem,https://bcl.nrel.gov/content/7a84292a-3975-4ab3-9284-6edabcbe750b,,,,,,
SetSpaceInfiltrationPerExteriorArea,Ruby measure,Set Space Infiltration Design Flow Rate per exterior area for the entire building.Repo: NREL/openstudio-common-measures-gem,https://bcl.nrel.gov/content/9d796dd3-c5cf-475a-81aa-607d3ba9d143,,,,,,
Add Output Diagnostics,Ruby measure,Often the eplusout.err file may request output diagnostics. This measure can be used to add this to the IDF file. Re-run your project to see the requested output.Repo: NREL/openstudio-common-measures-gem,https://bcl.nrel.gov/content/cb957503-4a01-42c4-a918-a44df4ea759c,,,,,,
Server Directory Cleanup,Ruby measure,Clean up files in the run directoryRepo: NREL/openstudio-common-measures-gem,https://bcl.nrel.gov/content/ec7d04ad-0b7b-495b-825a-e1b6d28d1d3f,,,,,,
Shadow Calculation,Ruby measure,"This measure sets the fields of the ShadowCalculation object, which is used to control some details of EnergyPluss solar, shadowing, and daylighting models.Repo: NREL/openstudio-common-measures-gem",https://bcl.nrel.gov/content/d0699b19-862f-4b68-9ff0-58483c45e0e8,,,,,,
Set COP for Two Speed DX Cooling Units,Ruby measure,This measure will find two speed DX cooling units in the model and will alter the Rated HighSpeed COP to a specified value. It can be run on a single or all air loops in the model.Repo: NREL/openstudio-common-measures-gem,https://bcl.nrel.gov/content/f5a8d60a-e60f-4097-99c3-28bfda3f29a3,,,,,,
Add Zone Ventilation Design Flow Rate Object,Ruby measure,This will allow you to add a ZoneVentilation:DesignFlowRate object into your model in a specified zone. The ventilation type is exposed as an argument but the design flow rate calculation method is set to design flow rate. A number of other object inputs are exposed as argumentsRepo: NREL/openstudio-common-measures-gem,https://bcl.nrel.gov/content/c31e2212-720d-413f-bdb9-f38e198dcfa3,,,,,,
ImportEnvelopeAndInternalLoadsFromIdf,Ruby measure,"This will replace the building in your current model with the building objects form the selected IDF file. This will include spaces and thermal zones, and related resources such as constructions, materials, internal loads, and schedules.Repo: NREL/openstudio-common-measures-gem",https://bcl.nrel.gov/content/10a3ffb4-de25-4cb3-87ff-5922219716f9,,,,,,
SetEnergyPlusMinimumOutdoorAirFlowRate,Ruby measure,Set the Minimum Outdoor Air FLow Rate for all Controller:OutdoorAir objects in the model. Input values are in SI units.Repo: NREL/openstudio-common-measures-gem,https://bcl.nrel.gov/content/90e4574a-b4cc-4a00-9b43-1fe9bb7e6e77,,,,,,
AddPCMtoEnv,Ruby measure,This measure can create new material with phase change property from user inputs and edit the idf file to run simulation.Repo: meftaH416/Openstudio_Measures_meftah,https://bcl.nrel.gov/content/93bac9cf-7401-433b-9028-97b478320a30,,,,,,
Change Building Size,Ruby measure,This measure will change the building area (footprint) and height of a building multiplying by user-defined fractions.Repo: meftaH416/Openstudio_Measures_meftah,https://bcl.nrel.gov/content/7e034a2e-b90a-4f7d-9d46-66a526fc4d42,,,,,,
Import IDF to OS,Ruby measure,This measure allows you to import an IDF file to Openstudio without further processRepo: meftaH416/Openstudio_Measures_meftah,https://bcl.nrel.gov/content/9389d683-ac75-4727-b0e1-be09703ad71b,,,,,,
Change Floor Area,Ruby measure,This measure will change the floor area of a building multiplying by a user-defined fraction.Repo: meftaH416/Openstudio_Measures_meftah,https://bcl.nrel.gov/content/ab2a85d4-ac29-4cd7-985b-90d9568ce7a7,,,,,,
AddSolarPVT,Ruby measure,This measure will add solar PhotoVoltaicThermal object to the system. PVT system can be add to airloop outdoor air system or plant loopRepo: meftaH416/Openstudio_Measures_meftah,https://bcl.nrel.gov/content/ff6c80a9-cfcf-43d5-bb31-2a960a40bfbe,,,,,,
AddPCMtoEnv,Ruby measure,This measure can create new material with phase change property from user inputs and edit the idf file to run simulation.Repo: meftaH416/Openstudio_Measures_meftah,https://bcl.nrel.gov/content/722fca36-fc10-40b8-a03a-53c7f33e0c60,,,,,,
Heat Recovery Chiller,Ruby measure,This measure adds a heat recovery chiller and heat recovery loop to the model. The heat recovery chiller may be an existing chiller or new stand-alone heat recovery chiller. Converting an existing chiller will allow the chiller to rejected heat to the heat recovery loop in addition to the...Repo: BuildingPerformanceSimulation/openstudio-measures,https://bcl.nrel.gov/content/968b3e43-1b47-4f29-b0af-f1c16b3e68c2,,,,,,
Create and Assign CLT Construction Set,Ruby measure,"This measure allows a modeler to change the construction set in their model for a CLT construction set. The measure includes options for CLT exterior walls, CLT interior floors, and roof. It also provides options to infer insulation levels from existing constructions, replace external walls, and...Repo: AMBER-Group-CSM/openstudio-amber-measures-gem",https://bcl.nrel.gov/content/56b4745a-ab7e-48e4-9a81-7f4f917994ab,,,,,,
Ideal Air Loads Zone HVAC,Ruby measure,"This OpenStudio measure will replace the existing HVAC system with ideal air loads objects for each conditioned zone and allow the user to specify input fields including availability schedules, humidity controls, outdoor air ventilation, demand controlled ventilation, economizer operation, and...Repo: BuildingPerformanceSimulation/openstudio-measures",https://bcl.nrel.gov/content/9cdff3b9-7ce1-4982-b555-bb83c73727e4,,,,,,
Export Model with Measure Changes,Ruby measure,"This measure exports the in.osm file created for the simulation, moves it to a specified directory, and renames it. The default name is {name_of_parent_model}_wMeasures.osm, but a custom name can be specified.Repo: AMBER-Group-CSM/openstudio-amber-measures-gem",https://bcl.nrel.gov/content/32bb20b8-b6da-4385-93bc-f574ecd82168,,,,,,
Configure OutputControlTableStyle,Ruby measure,This measure allows users to set the column separator and unit conversion options for the OutputControl:Table:Style object in an OpenStudio model.Repo: AMBER-Group-CSM/openstudio-amber-measures-gem,https://bcl.nrel.gov/content/489d41dd-0a04-4dbf-9bee-7882b2afea14,,,,,,
Create Typical Building,Ruby measure,"The ""Create Typical Building"" OpenStudio measures empowers users to effortlessly generate OpenStudio and EnergyPlus models by making a few select choices. Users can input preferences such as the building energy code year (e.g., ASHRAE 90.1-2013), climate zone, and desired heating, ventilation,...Repo: pnnl/openstudio-building-energy-standard-measures-gem",https://bcl.nrel.gov/content/fa93dfc5-9f4f-4f8f-9db7-3aa5ccf38e5d,,,,,,
Detailed HVAC Viewer,Ruby measure,This measure creates a facsimile of the HVAC grid layout in the OpenStudio Application in an interactive html report. The user can optionally select loops to add Output:Variable to view node timeseries output data.Repo: BuildingPerformanceSimulation/openstudio-measures,https://bcl.nrel.gov/content/416a484f-bd28-4db8-8926-7d70740390eb,,,,,,
Create Typical Building,Ruby measure,"The ""Create Typical Building"" OpenStudio measures empowers users to effortlessly generate OpenStudio and EnergyPlus models by making a few select choices. Users can input preferences such as the building energy code year (e.g., ASHRAE 90.1-2013), climate zone, and desired heating, ventilation,...Repo: pnnl/openstudio-building-energy-standard-measures-gem",https://bcl.nrel.gov/content/3ecef6eb-ae4e-48da-b955-594e44b546bf,,,,,,
Create ASHRAE 90.1-2019 PRM Model,Ruby measure,Create the Baseline Building per ASHRAE Standard 90.1-2019 Performance Rating Method. User manual for this measure please see  https://pnnl.github.io/BEM-for-PRM .Repo: pnnl/openstudio-building-energy-standard-measures-gem,https://bcl.nrel.gov/content/a984a630-2a41-45fd-80ec-6454777bf253,,,,,,
Generate IPLV-specific Chiller Performance Curves for Chillers (Chiller:Electric:EIR).,Python measure,This measure generates and assigns a set of performance curves to a chiller object that matches a target description including the chiller's integrated part load value (IPLV) for the Chiller:Electric:EIR model.Repo: pnnl/openstudio-building-energy-standard-measures-gem,https://bcl.nrel.gov/content/5cd98b4e-ddfe-44ab-9dca-d9885f57a216,,,,,,
TimeSeries Objective Function,Ruby measure,Creates Objective Function from Timeseries DataRepo: NREL/openstudio-calibration-gem,https://bcl.nrel.gov/content/6804217d-4737-45f3-82df-b81393c29ce3,,,,,,
Set OutputEnvironmentalImpactFactors,Ruby measure,"This measure initializes the Output:EnvironmentalImpactFactors, EnvironmentalImpactFactors, and FuelFactors objects.  It also allows the user to change district heating efficiency.Repo: Ski90Moo/OpenStudio_Measures_HEPLLC",https://bcl.nrel.gov/content/2192ece6-c387-4fbf-bf87-1436c479f41f,,,,,,
Add Wind and Stack Open Area,Ruby measure,"This measure models natural ventilation to thermal zones with operable casement type windows.  It is not intended to model natural ventilation that relies on interzone, stack driven air transfer.Repo: BuildingPerformanceSimulation/openstudio-measures",https://bcl.nrel.gov/content/c1290ecc-ef5b-4c64-8df5-367cc1129841,,,,,,
Add Wind and Stack Open Area Legacy,Ruby measure,"This measure models natural ventilation to thermal zones with operable casement type windows.  It is not intended to model natural ventilation that relies on interzone, stack driven air transfer.Repo: BuildingPerformanceSimulation/openstudio-measures",https://bcl.nrel.gov/content/39cf10cd-cc6f-4b0e-9913-f77d8aa30f3c,,,,,,
ZEDG VRF with DOAS,Ruby measure,Adds VRF system with multiple indoor units connected to an outdoor unit.Repo: NREL/openstudio-aedg-gem,https://bcl.nrel.gov/content/633b8efc-7bcb-4aa0-8821-d0ee08f960db,,,,,,
ZEDG K12 Insert Ground Domain E+ Kusdua,Ruby measure,"Measure to insert the EnergyPlus Site:GroundDomain:Slab object into the model and, when recommended, horizontal and vertical insulation.Repo: NREL/openstudio-aedg-gem",https://bcl.nrel.gov/content/aa8123f0-4d04-4141-8a00-8a2bccf30315,,,,,,
Set Ground Temperatures-Constant,Ruby measure,This measure will set an annual average ground temperature for ground contact surfaces.  It sets the EnergyPlus object Site:GroundTemperature:BuildingSurface to a constant specified temperature for the whole year.Repo: Ski90Moo/OpenStudio_Measures_HEPLLC,https://bcl.nrel.gov/content/42b30e3e-86f6-4adc-a8a2-79183caf1236,,,,,,
Set Ground Temperatures-Monthly,Ruby measure,This measure will set monthly average ground temperatures for ground contact surfaces.  It sets the EnergyPlus object Site:GroundTemperature:BuildingSurface.Repo: Ski90Moo/OpenStudio_Measures_HEPLLC,https://bcl.nrel.gov/content/a7048e34-ffd2-42ac-abb9-fbf549023872,,,,,,
Set Output Table To SI Units v2,Ruby measure,This measure keeps the output table in SI units and the sql file remains in SI units to allow generation of OpenStudio Results in SI units. Report is outputted in HTML and tab delimited. Includes output for Sizing period (ie. zone level reports). Only compatible with EnergyPlus versions after...Repo: Ski90Moo/OpenStudio_Measures_HEPLLC,https://bcl.nrel.gov/content/d9b6baa7-332b-47a0-a198-10406e6117f4,,,,,,
Set Output Table To IP Units v2,Ruby measure,"This measure changes the output table to be in IP units but the sql file remains in SI units to allow generation of OpenStudio Results. Only compatible with EnergyPlus versions after Feb 18, 2021Repo: Ski90Moo/OpenStudio_Measures_HEPLLC",https://bcl.nrel.gov/content/d19c3b12-6dd1-4efb-b3e6-397460a856b2,,,,,,
IdfToOsm,Ruby measure,Translate IDF to OSMRepo: automaticmagic/automaticmagic-measures,https://bcl.nrel.gov/content/efa9b068-4ce4-4a9d-b143-7488f08e77eb,,,,,,
Test Measure Recursive Folders,Ruby measure,A Measure to test whether supporting recursive subfolders worksRepo: jmarrec/openstudio-effibem-measures-gem,https://bcl.nrel.gov/content/b79e1024-8a7a-4c9d-91bf-6c11de58f4a9,,,,,,
ExportMetertoCSV,Ruby measure,Exports an OutputMeter specified in the AddOutputMeter OpenStudio measure to a csv file.Repo: BuildingPerformanceSimulation/openstudio-measures,https://bcl.nrel.gov/content/0d08ca00-7dea-436d-843a-a48a483cbf7c,,,,,,
Apply Now Reporting Measure,Ruby measure,"An example of how you can create something similar to a ReportingMeasure (that will create an HTML file) but is actually a ModelMeasure you can run in ""Apply Now""Repo: jmarrec/openstudio-effibem-measures-gem",https://bcl.nrel.gov/content/e43ed467-95da-4c60-ae50-95c225fad661,,,,,,
AedgK12ElectricEquipment,Ruby measure,"This measure removes all existing electric equipment from spaces recognized as primary or secondary school space types. One exception is that loads assigned directly to a space whre the load definition contains ""Elev"" or ""elev"" will be left alone. New electric equipment will be added based on...Repo: NREL/openstudio-aedg-gem",https://bcl.nrel.gov/content/4ef1195b-a7b2-4afc-8bbc-e0c28a86dfa4,,,,,,
AedgOfficeHvacWshpDoas,Ruby measure,"Measure replaces existing HVAC system (if any) with a Water Source Heat Pump (WSHP) with DOAS HVAC system (one DOAS per floor).  The WSHP with DOAS system (centralized DOAS, with zone level conditioning) is applied to all space types.  In select cases, the user is given the option to preserve...Repo: NREL/openstudio-aedg-gem",https://bcl.nrel.gov/content/aa5fbc1c-4dc2-4a51-84fa-ce5e291f77b6,,,,,,
AedgK12ElectricEquipmentControls,Ruby measure,"This measure reduces the values associated with electric equipment schedules to simulate reductions due to equipment controls throughout the building. This includes occupancy based outlets or adapters, as well as network or timer based controls. Kitchen equipment controls are not altered by this...Repo: NREL/openstudio-aedg-gem",https://bcl.nrel.gov/content/285bc263-7429-4049-a0ce-f60fabf46eec,,,,,,
AedgK12EnvelopeAndEntryInfiltration,Ruby measure,This measure addresses two sources of air infiltration. The first is infiltration through the building envelope. The second is infiltration due to occupants entering and leaving the building. The AEDG provides recommendations and tips on how to limit infiltration in both cases. For occupant...Repo: NREL/openstudio-aedg-gem,https://bcl.nrel.gov/content/02447d29-ee6a-436a-af49-3358ad90f7aa,,,,,,
AedgK12ExteriorWallConstruction,Ruby measure,This measure will modify existing exterior wall insulation levels based on construction type and climate zone. The exterior wall construction type and climate zone should be set in the model prior to using this measure. For mass and metal walls if an existing insulation layer can be found it...Repo: NREL/openstudio-aedg-gem,https://bcl.nrel.gov/content/f555ea01-39b7-4c4d-94ff-73ba6a6b96fd,,,,,,
AedgK12Swh,Ruby measure,Measure replaces existing swh equipment (if any) with the swh equipment recommendations of the 50% K-12 AEDG.Repo: NREL/openstudio-aedg-gem,https://bcl.nrel.gov/content/081b3ccb-fc4a-48f7-ad50-87c90c20f9f9,,,,,,
AedgOfficeHvacAshpDoas,Ruby measure,"Measure replaces existing HVAC system (if any) with an Air Source Heat Pump (ASHP) with DOAS HVAC system (one DOAS per floor).  The ASHP with DOAS system (centralized DOAS, with zone level conditioning) is applied to all space types.  In select cases, the user is given the option to preserve...Repo: NREL/openstudio-aedg-gem",https://bcl.nrel.gov/content/18c59c3c-d994-46a9-b3eb-39b983b93ef8,,,,,,
AedgOfficeHvacVavChW,Ruby measure,"Measure replaces existing HVAC system (if any) with a high efficiency multizone variable air volume (VAV) HVAC system (one system per floor).  The multizone VAV system (centralized cooling with zone level heating) is applied to all space types.  In select cases, the user is given the option to...Repo: NREL/openstudio-aedg-gem",https://bcl.nrel.gov/content/28e4e4fb-a10a-4f85-82f9-c4ad2dd3cf12,,,,,,
AedgOfficeSwh,Ruby measure,Measure replaces existing swh equipment (if any) with the swh equipment recommendations of the 50% Small and Medium Office AEDG.Repo: NREL/openstudio-aedg-gem,https://bcl.nrel.gov/content/42e0df75-b1b0-4f52-9c3b-3895dbe5ed0e,,,,,,
AedgSmallToMediumOfficeInteriorLightingControls,Ruby measure,This measure reduces the values associated with lighting schedules to simulate reductions due to vacancy sensors throughout the building.Repo: NREL/openstudio-aedg-gem,https://bcl.nrel.gov/content/57ba8820-6394-4c76-86c3-cc045a8a2b26,,,,,,
